<?xml version="1.0" encoding="UTF-8"?>
<list xmlns:xsi="http://www.w3.org/2001/XMLSchema-instance" xsi:noNamespaceSchemaLocation="../../xsd/items.xsd">
	<item id="29000" name="Scorpio Agathion Charm From the Star" additionalName="Stage 4" type="Armor">
		<!-- A charm that activates the power of the Scorpio Agathion.Combine with Starlight Jar up to Stage 12, and upgrade to +10 by using Book of Growth. Its special ability is Scorpion's Mass Exile Lv. 4, and depending on the level of the charm, a unique ability will be added. When equipped on the main slot of the Agathion Bracelet, the Agathion will be summoned automatically, and both special and unique abilities will be activated. When equipped on the sub slot, only the unique ability will be activated. <Note>When combining, the growth value of the Agathion Charm will be reset. -->
		<set name="icon" val="BranchIcon.icon.g_bm_sco_agathion_charm" />
		<set name="default_action" val="EQUIP" />
		<set name="bodypart" val="hair" />
		<set name="immediate_effect" val="true" />
		<set name="crystal_type" val="R" />
		<set name="material" val="LEATHER" />
		<set name="weight" val="510" />
		<set name="enchant_enabled" val="1" />
		<set name="is_tradable" val="false" />
		<set name="is_dropable" val="false" />
		<set name="is_depositable" val="false" />
		<set name="is_sellable" val="false" />
	</item>
	<item id="29001" name="Scorpio Agathion Charm From the Star" additionalName="Stage 5" type="Armor">
		<!-- A charm that activates the power of the Scorpio Agathion.Combine with Starlight Jar up to Stage 12, and upgrade to +10 by using Book of Growth. Its special ability is Scorpion's Mass Exile Lv. 5, and depending on the level of the charm, a unique ability will be added. When equipped on the main slot of the Agathion Bracelet, the Agathion will be summoned automatically, and both special and unique abilities will be activated. When equipped on the sub slot, only the unique ability will be activated. <Note>When combining, the growth value of the Agathion Charm will be reset. -->
		<set name="icon" val="BranchIcon.icon.g_bm_sco_agathion_charm" />
		<set name="default_action" val="EQUIP" />
		<set name="bodypart" val="lhand" />
		<set name="immediate_effect" val="true" />
		<set name="crystal_type" val="R" />
		<set name="material" val="LEATHER" />
		<set name="weight" val="1070" />
		<set name="enchant_enabled" val="1" />
		<set name="is_tradable" val="false" />
		<set name="is_dropable" val="false" />
		<set name="is_depositable" val="false" />
		<set name="is_sellable" val="false" />
	</item>
	<item id="29002" name="Scorpio Agathion Charm From the Star" additionalName="Stage 6" type="Armor">
		<!-- A charm that activates the power of the Scorpio Agathion.Combine with Starlight Jar up to Stage 12, and upgrade to +10 by using Book of Growth. Its special ability is Scorpion's Mass Exile Lv. 6, and depending on the level of the charm, a unique ability will be added. When equipped on the main slot of the Agathion Bracelet, the Agathion will be summoned automatically, and both special and unique abilities will be activated. When equipped on the sub slot, only the unique ability will be activated. <Note>When combining, the growth value of the Agathion Charm will be reset. -->
		<set name="icon" val="BranchIcon.icon.g_bm_sco_agathion_charm" />
		<set name="default_action" val="EQUIP" />
		<set name="bodypart" val="head" />
		<set name="immediate_effect" val="true" />
		<set name="crystal_type" val="R" />
		<set name="material" val="BONE" />
		<set name="weight" val="530" />
		<set name="enchant_enabled" val="1" />
		<set name="is_tradable" val="false" />
		<set name="is_dropable" val="false" />
		<set name="is_depositable" val="false" />
		<set name="is_sellable" val="false" />
	</item>
	<item id="29003" name="Scorpio Agathion Charm From the Star" additionalName="Stage 7" type="Armor">
		<!-- A charm that activates the power of the Scorpio Agathion.Combine with Starlight Jar up to Stage 12, and upgrade to +10 by using Book of Growth. Its special ability is Scorpion's Mass Exile Lv. 7, and depending on the level of the charm, a unique ability will be added. When equipped on the main slot of the Agathion Bracelet, the Agathion will be summoned automatically, and both special and unique abilities will be activated. When equipped on the sub slot, only the unique ability will be activated. <Note>When combining, the growth value of the Agathion Charm will be reset. -->
		<set name="icon" val="BranchIcon.icon.g_bm_sco_agathion_charm" />
		<set name="default_action" val="EQUIP" />
		<set name="armor_type" val="MAGIC" />
		<set name="bodypart" val="hair2" />
		<set name="immediate_effect" val="true" />
		<set name="crystal_type" val="R" />
		<set name="material" val="BRONZE" />
		<set name="weight" val="1750" />
		<set name="enchant_enabled" val="1" />
		<set name="is_tradable" val="false" />
		<set name="is_dropable" val="false" />
		<set name="is_depositable" val="false" />
		<set name="is_sellable" val="false" />
		<stats>
			<stat type="maxMp">649</stat>
		</stats>
	</item>
	<item id="29004" name="Scorpio Agathion Charm From the Star" additionalName="Stage 8" type="Armor">
		<!-- A charm that activates the power of the Scorpio Agathion.Combine with Starlight Jar up to Stage 12, and upgrade to +10 by using Book of Growth. Its special ability is Scorpion's Mass Exile Lv. 8, and depending on the level of the charm, a unique ability will be added. When equipped on the main slot of the Agathion Bracelet, the Agathion will be summoned automatically, and both special and unique abilities will be activated. When equipped on the sub slot, only the unique ability will be activated. <Note>When combining, the growth value of the Agathion Charm will be reset. -->
		<set name="icon" val="BranchIcon.icon.g_bm_sco_agathion_charm" />
		<set name="default_action" val="EQUIP" />
		<set name="armor_type" val="MAGIC" />
		<set name="immediate_effect" val="true" />
		<set name="crystal_type" val="R" />
		<set name="material" val="SCALE_OF_DRAGON" />
		<set name="weight" val="850" />
		<set name="enchant_enabled" val="1" />
		<set name="is_tradable" val="false" />
		<set name="is_dropable" val="false" />
		<set name="is_depositable" val="false" />
		<set name="is_sellable" val="false" />
		<stats>
			<stat type="maxMp">427</stat>
		</stats>
	</item>
	<item id="29005" name="Scorpio Agathion Charm From the Star" additionalName="Stage 9" type="Armor">
		<!-- A charm that activates the power of the Scorpio Agathion.Combine with Starlight Jar up to Stage 12, and upgrade to +10 by using Book of Growth. Its special ability is Scorpion's Mass Exile Lv. 9, and depending on the level of the charm, a unique ability will be added. When equipped on the main slot of the Agathion Bracelet, the Agathion will be summoned automatically, and both special and unique abilities will be activated. When equipped on the sub slot, only the unique ability will be activated. <Note>When combining, the growth value of the Agathion Charm will be reset. -->
		<set name="icon" val="BranchIcon.icon.g_bm_sco_agathion_charm" />
		<set name="default_action" val="EQUIP" />
		<set name="bodypart" val="hair" />
		<set name="immediate_effect" val="true" />
		<set name="crystal_type" val="R" />
		<set name="material" val="LEATHER" />
		<set name="weight" val="510" />
		<set name="enchant_enabled" val="1" />
		<set name="is_tradable" val="false" />
		<set name="is_dropable" val="false" />
		<set name="is_depositable" val="false" />
		<set name="is_sellable" val="false" />
	</item>
	<item id="29006" name="Scorpio Agathion Charm From the Star" additionalName="Stage 10" type="Armor">
		<!-- A charm that activates the power of the Scorpio Agathion.Combine with Starlight Jar up to Stage 12, and upgrade to +10 by using Book of Growth. Its special ability is Scorpion's Mass Exile Lv. 10, and depending on the level of the charm, a unique ability will be added. When equipped on the main slot of the Agathion Bracelet, the Agathion will be summoned automatically, and both special and unique abilities will be activated. When equipped on the sub slot, only the unique ability will be activated. <Note>When combining, the growth value of the Agathion Charm will be reset. -->
		<set name="icon" val="BranchIcon.icon.g_bm_sco_agathion_charm" />
		<set name="default_action" val="EQUIP" />
		<set name="bodypart" val="lhand" />
		<set name="immediate_effect" val="true" />
		<set name="crystal_type" val="R" />
		<set name="material" val="LEATHER" />
		<set name="weight" val="1070" />
		<set name="enchant_enabled" val="1" />
		<set name="is_tradable" val="false" />
		<set name="is_dropable" val="false" />
		<set name="is_depositable" val="false" />
		<set name="is_sellable" val="false" />
	</item>
	<item id="29007" name="Scorpio Agathion Charm From the Star" additionalName="Stage 11" type="Armor">
		<!-- A charm that activates the power of the Scorpio Agathion.Combine with Starlight Jar up to Stage 12, and upgrade to +10 by using Book of Growth. Its special ability is Scorpion's Mass Exile Lv. 11, and depending on the level of the charm, a unique ability will be added. When equipped on the main slot of the Agathion Bracelet, the Agathion will be summoned automatically, and both special and unique abilities will be activated. When equipped on the sub slot, only the unique ability will be activated. <Note>When combining, the growth value of the Agathion Charm will be reset. -->
		<set name="icon" val="BranchIcon.icon.g_bm_sco_agathion_charm" />
		<set name="default_action" val="EQUIP" />
		<set name="bodypart" val="head" />
		<set name="immediate_effect" val="true" />
		<set name="crystal_type" val="R" />
		<set name="material" val="BONE" />
		<set name="weight" val="530" />
		<set name="enchant_enabled" val="1" />